question,answer,tags,priority,purpose
"繁忙期はいつですか？","当駐車場における繁忙期とは、旅行者が多くなる期間（例：お盆やゴールデンウィーク）を指します。繁忙期の最新情報はWeb『https://park-ride.net/index.html』でご確認ください。","繁忙期,日程確認,最新情報,案内","高","繁忙期の日程に関する案内の明確化"
"繁忙期の期間を教えてください。","繁忙期に関する情報はWeb『https://park-ride.net/index.html』でご確認ください。【補足】具体的なご旅行予定を教えていただければ、該当する繁忙期かどうかご案内可能です。","繁忙期,日程確認,旅行予定,案内","高","繁忙期の特定期間に関する柔軟な案内"
"繁忙期が始まるのはいつですか？","最新の繁忙期情報はWeb『https://park-ride.net/index.html』にてご確認いただけます。例年、繁忙期にはお盆（8月中旬）やゴールデンウィーク（4月下旬〜5月初旬）が含まれます。","繁忙期,開始日,日程確認,最新情報,案内","高","繁忙期開始日の明確化"
"繁忙期の日程は？","繁忙期とは、旅行や帰省が増える期間（例：お盆休み、年末年始）を指します。詳細な日程はWeb『https://park-ride.net/index.html』でご確認ください。","繁忙期,日程確認,一般的説明,案内","高","繁忙期における日程の明確化"
"ピーク期間はいつですか？","当駐車場の繁忙期情報はWeb『https://park-ride.net/index.html』でご確認ください。例年、繁忙期には特定の旅行シーズンが含まれます。具体的な日程については最新情報をご参照ください。","繁忙期,ピーク期間,最新情報,案内","高","ピーク期間に関する明確な案内"