question,answer,tags,priority,purpose
"予約の条件はありますか？","以下の条件でのみ予約が可能です：\n\n・利用期間全日程に空きがある場合のみ予約可能\n・1日ずつ日程を分けた予約は不可\n・繁忙期の仮押さえ予約は不可（キャンセル扱い）\n\n※予約完了画面が表示されれば予約確定となります。\n※自動返信メールも併せてご確認ください。","reservation_rules,予約条件","最重要","予約条件の明確化"
"対象便の時間は？","国内線の営業対応時間に基づき、以下の便が対象です：\n\n【出発便】\n・朝5時以降の便\n【到着便】\n・通常は23時30分までの便\n\n※到着が24時を過ぎる場合、追加料金が発生する可能性があります。\n※遅延や到着時間変更がある場合は事前連絡をお願いします。","reservation_rules,対象便","最重要","対応可能便の明確化"
"キャンセル待ちはできますか？","申し訳ございませんが、キャンセル待ちは承っておりません。\n\n理由：\n・予約システムがリアルタイムで更新されるため\n・キャンセル発生時は予約サイト上に反映されます\n\n※空き状況は予約サイトで随時ご確認ください。","reservation_rules,キャンセル待ち","最重要","キャンセル待ち制限の明確化"
"満車の場合は空き状況を電話で確認できますか？","申し訳ございませんが、空き状況はWEB予約システムでのみ確認可能です。\n\n【軽自動車枠について】\n・軽自動車専用枠がある場合は21時以降に電話で予約可能です。\n・翌日利用の場合、22時までにご予約ください。","reservation_rules,空き状況","最重要","空き状況確認方法の明確化"
"キャンセル枠の確認方法を教えてください","キャンセル枠は予約サイトに即時反映されません。最新情報は随時更新されるため、こまめにWebサイトをご確認ください。なお、キャンセル待ちは承っておりません。","reservation_rules,キャンセル枠","最重要","キャンセル枠に関する問い合わせを減らす"
"予約の変更はできますか？","予約内容の変更には制限があります。変更可能な項目と変更できない項目がございますので、詳細をご確認ください。","reservation_rules,予約変更","最重要","変更ルールの明確化"