id,question,answer,parent_id,tags,priority,purpose,chunk_type
53,"6名以上での利用方法について教えてください","「ひとり送迎プラン」でご利用いただけます。\n\nご利用方法：\n1. 空港で荷物と同乗者様を降ろしていただきます\n2. 駐車場へ来場\n3. 運転手様1名のみを空港まで送迎\n\n※複数台でのご利用の場合も、各車両の運転手様1名ずつの送迎となります。\n※お帰りの際は逆の手順となります。","14","capacity_rules,送迎サービス,ひとり送迎","最重要","大人数対応の明確化","child"
54,"お子様の同乗は可能ですか？","お子様が同乗される場合でも、送迎には問題ございません。1台のご予約につき、同乗者様（お子様含む）5名様までとなります。","14","capacity_rules,送迎サービス,お子様同乗","最重要","お子様同乗基準の明確化","child"
55,"予約内容をひとり送迎に変更できますか？","予約内容の変更についてですが、運転手様のみの「ひとり送迎」に変更することは可能です。\n\nご利用方法：\n1. 空港で荷物と同乗者様を降ろしていただきます\n2. 駐車場へ来場\n3. 運転手様1名のみを空港まで送迎いたします\n\n※お帰りの際は逆の手順となります。","14","capacity_rules,予約変更,ひとり送迎","最重要","ひとり送迎変更手順の明確化","child"
56,"[0-9]+台で[0-9]+名","複数台や大人数でのご利用の場合は「ひとり送迎プラン」のご利用をお願いしております。\n\n送迎の流れ：\n1. 空港で荷物と同乗者を降ろし\n2. 駐車場に移動\n3. 運転手1名のみを空港まで送迎\n\n※送迎車は乗合となります。","14","capacity_rules,送迎サービス,ひとり送迎,大人数対応","最重要","複数台利用の明確化","child"
57,"(?:車椅子|wheelchair).*(?:一人|1人|単独)","車椅子で単独でご利用の場合は、自力で送迎車への乗り降りが可能な方のみとなります。\n\n注意事項：\n・折りたたみ式車椅子のみ対応可能\n・スロープ等の設備はございません\n・ご不安な場合は介助者の同伴をお勧めします。","14","capacity_rules,送迎サービス,車椅子対応,条件付き対応","高","車椅子利用時の基準明確化","child"
58,"国内送迎プランの条件を教えてください","以下の条件でご利用いただけます：\n\n【サイズ】\n・高さ1.95m以内、幅1.85m以内、長さ5.05m以内の車両（車検証要確認。キャリアやルーフボックスも高さに含まれます）\n\n【利用人数】\n・5名様まで\n\n【料金】\n・基本料金: 1,000円","15","transportation_plans_knowledge,送迎プラン,国内送迎プラン,条件","高","国内送迎プランの利用条件明確化","child"
59,"軽自動車送迎プランの詳細を教えてください","軽自動車を対象とした送迎プランです。\n\n【サイズ】\n・高さ1.95m以内（キャリアやルーフボックスも高さに含まれます）\n\n【料金】\n・基本料金: 1,000円から1日につき100円引き","15","transportation_plans_knowledge,送迎プラン,軽自動車,割引","高","軽自動車送迎プランの詳細明確化","child"
60,"コンパクトカー割引送迎プランの詳細を教えてください","コンパクトカーを対象とした割引送迎プランです。\n\n【利用人数】\n・2名様まで\n\n【料金】\n・基本料金: 1,000円から1日につき100円引き\n\n【対象車種例】\n・トヨタ: ヴィッツ、スペード、アクア\n・ニッサン: マーチ、ノート（※ノートオーラは不可）\n・ホンダ: フリード、フィット（※フィットシャトルは不可）","15","transportation_plans_knowledge,送迎プラン,コンパクトカー,割引","高","コンパクトカー送迎プランの詳細明確化","child"
61,"大型車プランの条件を教えてください","高さ1.95m以上2.1m以下の車両を対象としたプランです。\n\n【サイズ】\n・高さ1.95m以上2.1m以下、幅1.85m以上、長さ5.05m以上の車両\n\n【利用人数】\n・5名様まで\n\n【料金】\n・基本料金に1日につき1,000円追加","15","transportation_plans_knowledge,送迎プラン,大型車,追加料金","高","大型車プランの条件明確化","child"
62,"長期預り割引プランは利用できますか？","以下の条件でご利用いただけます：\n\n【対象】\n・6泊7日以上ご利用のお客様\n\n【料金】\n・1日/1,000円（期間中の料金が一律。週末等のアップ料金が一切ありません）\n\n【注意事項】\n・繁忙期は適用外です\n・他の割引との併用はできません","15","transportation_plans_knowledge,長期割引,繁忙期適用外,割引プラン","高","長期預り割引プランの条件明確化","child"
63,"繁忙期に大型車プランを利用できますか？","繁忙期には大型車プランの受け入れを行っておりません。\n\n【注意事項】\n・システム上、繁忙期でもご予約が受付される場合がありますが、繁忙期中の大型車予約はすべてキャンセル扱いとなります。\n・ご不明な点がございましたら、事前にお問い合わせください。","15","transportation_plans_knowledge,繁忙期対応,大型車制限,受入不可,システム制限","最重要","繁忙期の大型車制限の明確化","child"
64,"繁忙期に長期預り割引プランは利用できますか？","繁忙期には長期預り割引プランの適用はございません。\n\n【注意事項】\n・システム上、繁忙期でも割引プランでのご予約が受付される場合がありますが、繁忙期中のご予約には割引が適用されませんのでご了承ください。\n・ご不明な点がございましたら、事前にお問い合わせください。","15","transportation_plans_knowledge,繁忙期対応,割引プラン,適用外,システム制限","最重要","繁忙期における割引制限の明確化","child"
65,"送迎サービスのプランを教えてください","以下の送迎サービスプランをご利用いただけます：\n\n1. 国内送迎プラン\n2. 軽自動車送迎プラン\n3. コンパクトカー割引送迎プラン\n4. 大型車プラン\n5. 長期預り割引プラン（送迎あり）\n\n各プランの詳細は、条件や料金をご確認ください。","15","transportation_plans_knowledge,送迎サービス,送迎プラン,全体説明","高","送迎プラン全体の概要明確化","child"
66,"送迎が不要な場合の利用プランは？","送迎が不要な場合は、予約フォームの備考欄に以下のようにご記入ください：\n\n例: 「送迎なし：理由　〇〇のため」\n\n※ご記入いただいた理由をもとに対応の可否を判断させていただきます。","15","transportation_plans_knowledge,送迎なし,駐車サービス,利用プラン","高","送迎なしの場合の案内明確化","child"
67,"[0-9]+台で[0-9]+名","複数台や大人数でのご利用の場合は「ひとり送迎プラン」のご利用をお願いしております。\n\n送迎の流れ：\n1. 各車両で運転手様1名が空港で荷物と同乗者を降ろしていただきます\n2. 当駐車場へ各車両で来場\n3. 各車両の運転手様1名のみを空港まで送迎します\n\n※お帰りの際は逆の手順となります\n※送迎車は乗合となります","16","group_usage,送迎サービス,ひとり送迎,団体利用,大人数対応","最重要","団体利用時のルール明確化","child"
68,"団体利用時のルール","団体（複数台または大人数）でご利用の場合、以下のルールが適用されます：\n\n送迎の流れ：\n1. 各車両で運転手様1名が空港で荷物と同乗者を降ろしていただきます\n2. 当駐車場へ各車両で来場\n3. 各車両の運転手様1名のみを空港まで送迎します\n\n※お帰りの際は逆の手順となります\n※送迎車は乗合となります","16","group_usage,送迎サービス,団体利用,大人数対応","最重要","団体利用の手順明確化","child"
69,"社員旅行","ご予約時に「領収書希望」とお申し付けください。\n\n注意事項：\n・領収書は後日発行できかねます\n・必ず予約時にお申し出ください\n・宛名等の詳細もお知らせください","16","group_usage,領収書対応,ビジネス利用","高","領収書対応の明確化","child"
70,"団体での領収書発行","[領収書発行の注意点]\n・ご予約時に「領収書希望」とお申し出ください\n・宛名や但し書きなどの詳細をお知らせください\n・後日発行はできかねます\n・車両ごとの分割発行も可能です","16","group_usage,領収書対応,ビジネス利用,団体利用","高","団体領収書対応の明確化","child"
71,"深夜到着の場合の料金はどうなりますか？","24時以降に飛行機が羽田空港に到着した場合、追加料金が発生いたします：\n\n【追加料金】\n・24時以降：深夜料金2,000円追加\n・24時30分以降：翌朝5時以降の対応となり、1日分の延泊料金が加算されます。\n\n【注意事項】\n・遅延・欠航、便変更が発生した場合は、必ず飛行機搭乗時間前にお電話でご連絡ください。\n・追加料金が発生する条件についての詳細は、Webサイト（https://park-ride.net/）をご確認ください。\n\n※延泊を前提とした予約はお受けしておりません。\n※ピーク期間には別途ピーク料金が発生します。","17","fee_rules,料金ルール,深夜料金,延泊制限,追加料金,遅延連絡,駐車料金","高","深夜料金の明確化","child"
72,"早く帰ってきた場合の料金は変わりますか？","予約した合計金額が請求されます。\n\n【注意事項】\n・早めのご連絡をお願いいたします（車両準備のため）。\n・延泊を前提とした予約はお受けしておりません。\n・やむを得ず延泊が必要な場合は、1日ごとの料金を追加。\n・ピーク期間には追加料金が加算されます。","17","fee_rules,料金ルール,早帰り,延泊制限,追加料金,駐車料金","中","料金変更の明確化","child"
73,"鍵を持って帰ってしまった場合はどうなりますか？","鍵の持ち帰り・預け忘れには5,000円の手数料を申し受けます：\n\n【詳細】\n・理由：場内での車両移動が必要なため\n・金額：一律5,000円\n・対象：利用日数にかかわらず適用\n\n【注意事項】\n・鍵の受け渡し時に、必ずお手元の鍵を再確認ください。\n・鍵の持ち帰り防止のため、スタッフからの確認を徹底しております。\n\n※早めのご返送をお願いいたします。","17","fee_rules,ペナルティ,鍵,手数料,注意喚起,追加料金,駐車料金","高","鍵紛失対応の明確化","child"
74,"駐車料金はどのように計算されますか？","お世話になっております。パーク&ライド羽田でございます。\n\n駐車料金について、ご案内いたします：\n\n【基本料金】\n・1日あたり1,000円\n\n【週末料金】\n・金土日祝日は1日あたり300円追加\n\n【追加料金】\n・深夜到着（24時以降）：2,000円追加\n・延泊：1日分の料金追加\n・繁忙期：別途ピーク料金\n\n【ご注意】\n・Web予約時に合計金額が自動計算されます\n・予約フォームで金額をご確認のうえ、お進みください\n\n※詳細は、Webサイト（https://park-ride.net/）をご確認ください。","17","fee_rules,料金ルール,料金計算,駐車料金,追加料金,週末料金,繁忙期","高","駐車料金計算方法の明確化","child"
75,"追加料金が発生するケースは？","以下のケースで追加料金が発生します：\n\n【追加料金の条件】\n1. 深夜到着（24時以降）: 2,000円追加\n2. 延泊: 1日分の料金追加\n3. 鍵の持ち帰り・預け忘れ: 5,000円の手数料\n4. ピーク期間: 別途ピーク料金\n\n※詳細は、Webサイト（https://park-ride.net/）をご確認ください。","17","fee_rules,料金ルール,追加料金,深夜料金,延泊制限,駐車料金","高","追加料金条件の明確化","child"
76,"繁忙期に大型車プランを利用できますか？","繁忙期には大型車プランの受け入れを行っておりません。\n\n【注意事項】\n・システム上、繁忙期でもご予約が受付される場合がありますが、繁忙期中の大型車予約はすべてキャンセル扱いとなります。\n・ご不明な点がございましたら、事前にお問い合わせください。","18","peak_season,繁忙期対応,大型車制限,受入不可,システム制限","最重要","繁忙期の大型車制限の明確化","child"
77,"繁忙期に長期預り割引プランは利用できますか？","繁忙期には長期預り割引プランの適用はございません。\n\n【注意事項】\n・システム上、繁忙期でも割引プランでのご予約が受付される場合がありますが、繁忙期中のご予約には割引が適用されませんのでご了承ください。\n・ご不明な点がございましたら、事前にお問い合わせください。","18","peak_season,繁忙期対応,割引プラン,適用外,システム制限","最重要","繁忙期における割引制限の明確化","child"
78,"繁忙期の利用制限について教えてください。","繁忙期には以下の制限がございます：\n・大型車プランの受け入れ不可\n・長期預り割引プランの適用外","18","peak_season,繁忙期対応,利用制限,総合案内","最重要","繁忙期における全般的な利用制限の明確化","child"
79,"繁忙期の予約のコツはありますか？","繁忙期のご予約には以下のポイントにご注意ください：\n・早めの予約をおすすめします（繁忙期は予約が埋まりやすいため）\n・長期預り割引プランは適用されません\n・大型車プランはご利用いただけません\n・ご不明点はWeb『Information』をご確認ください（https://park-ride.net/）","18","peak_season,繁忙期対応,予約方法,予約コツ","高","繁忙期の予約方法に関する具体的なガイダンス提供","child"
80,"繁忙期の料金体系を教えてください。","繁忙期の料金体系につきましては、最新の情報をWebサイト（https://park-ride.net/）でご確認ください。","18","peak_season,繁忙期対応,料金体系,確認案内","高","繁忙期料金の最新情報の提供","child"
81,"繁忙期にコンパクトカープランは利用可能ですか？","コンパクトカープランは繁忙期に関係なくご利用いただけます。","18","peak_season,繁忙期対応,コンパクトカー,プラン利用可","中","繁忙期中のプラン利用に関する疑問解消","child"
82,"繁忙期に軽自動車プランを利用できますか？","軽自動車プランは繁忙期に関係なくご利用いただけます。","18","peak_season,繁忙期対応,軽自動車,プラン利用可","中","繁忙期中のプラン利用に関する疑問解消","child"
83,"繁忙期の予約キャンセルルールを教えてください。","繁忙期のキャンセルルールは、通常のキャンセルルールと同様です。詳細はWebサイト（https://park-ride.net/）をご確認ください。","18","peak_season,繁忙期対応,キャンセルルール,確認案内","高","繁忙期のキャンセル規定の明確化","child"
84,"繁忙期はいつですか？","当駐車場における繁忙期とは、旅行者が多くなる期間（例：お盆やゴールデンウィーク）を指します。繁忙期の最新情報はWebサイト（https://park-ride.net/）でご確認ください。","18","peak_season,繁忙期,日程確認,最新情報,案内","高","繁忙期の日程に関する案内の明確化","child"
85,"繁忙期の期間を教えてください。","繁忙期に関する情報はWebサイト（https://park-ride.net/）でご確認ください。【補足】具体的なご旅行予定を教えていただければ、該当する繁忙期かどうかご案内可能です。","18","peak_season,繁忙期,日程確認,旅行予定,案内","高","繁忙期の特定期間に関する柔軟な案内","child"
86,"繁忙期が始まるのはいつですか？","最新の繁忙期情報はWebサイト（https://park-ride.net/）にてご確認いただけます。例年、繁忙期にはお盆（8月中旬）やゴールデンウィーク（4月下旬〜5月初旬）が含まれます。","18","peak_season,繁忙期,開始日,日程確認,最新情報,案内","高","繁忙期開始日の明確化","child"
87,"ピーク期間はいつですか？","当駐車場の繁忙期情報はWebサイト（https://park-ride.net/）でご確認ください。例年、繁忙期には特定の旅行シーズンが含まれます。具体的な日程については最新情報をご参照ください。","18","peak_season,繁忙期,ピーク期間,最新情報,案内","高","ピーク期間に関する明確な案内","child"
88,"満車の場合の対応について教えてください","当駐車場では以下の対応を行っております：\n\n1. キャンセル待ちはできません。軽自動車枠への車種変更が可能な場合、21時以降にお電話でご相談ください。\n2. キャンセル枠はWebサイトに順次反映されますが、即時反映されない場合があります。\n3. 満車日の分割予約は全てキャンセル対象となります。\n\n【注意】当駐車場は満車の場合の代替案をご案内しておりません。詳細はWebサイト（https://park-ride.net/）をご確認ください。","19","full_parking_responses,満車対応,キャンセル枠,分割予約禁止","高","満車時の対応方法を明確化し、利用者の疑問や不安を解消する。","child"
89,"空きが出た場合の通知を受け取ることはできますか？","キャンセル待ちはできません。当駐車場では、空きが出た場合の個別通知は行っておりません。空き状況はWebサイトをご確認ください。","19","full_parking_responses,空き状況,通知不可","中","空き状況に関する問い合わせを減らす。","child"
90,"軽自動車枠について相談するにはどうしたら良いですか？","軽自動車枠への車種変更が可能な場合、21時以降にお電話でご相談いただけます。ただし、軽自動車枠が既に満車の場合はご対応できませんのでご了承ください。キャンセル待ちはできません。","19","full_parking_responses,軽自動車枠,相談","中","軽自動車枠に関する特例について案内し、利用者の選択肢を提供する。","child"
91,"分割予約は禁止されていますか？","はい、満車日を挟む複数の分割予約は禁止されています。\n\n【注意】「満車（×）の前の空き日程（例：12月1日〜2日）」を予約。\n「満車（×）の後の空き日程（例：12月4日〜5日）」を予約。\n「満車（×）が空いた場合（例：12月3日）」を予約。\n このような行為は全てキャンセル対象となります。発覚した場合、全ての予約がキャンセル対象となります。","19","full_parking_responses,分割予約,禁止事項","高","分割予約に関するトラブルを防ぐ。","child"
92,"東京方面から大井南出口を利用する場合の道順を教えてください","以下の道順で駐車場にアクセスできます：\n\n【道順】\n1. 首都高速湾岸線「大井南出口」を出て国道357号線を羽田空港方面へ直進。\n2. 2つ目の信号を10mほど過ぎた右側、高架下が駐車場入口です。\n\n【ナビ設定】\n- カーナビでは「パーク＆ライド羽田」を検索してください。\n- 京浜島ふ頭公園付近が表示されます。\n- 公園向かい側、首都高湾岸線高架下が駐車場です。\n- 電話番号では検索できません。\n\n【Google Mapsでの検索】\n1. 「パーク＆ライド羽田」を検索。\n2. オプションから「高速道路を使わない」を選択してください。","20","navigation_and_access,ナビゲーション,東京方面,大井南出口,アクセス方法","高","東京方面からのアクセス方法の明確化","child"
93,"横浜方面から湾岸環八出口を利用する場合の道順を教えてください","以下の道順で駐車場にアクセスできます：\n\n【道順】\n1. 首都高速湾岸線「湾岸環八出口」を出て環七・大井埠頭方面（357号）へ。\n2. 空港北トンネルを出て1つ目の信号を右折。\n3. 次の信号も右折。\n4. 10mほど進んだ右側が駐車場入口です。\n\n【ナビ設定】\n- カーナビでは「パーク＆ライド羽田」を検索してください。\n- 京浜島ふ頭公園付近が表示されます。\n- 公園向かい側、首都高湾岸線高架下が駐車場です。\n- 電話番号では検索できません。\n\n【Google Mapsでの検索】\n1. 「パーク＆ライド羽田」を検索。\n2. オプションから「高速道路を使わない」を選択してください。","20","navigation_and_access,ナビゲーション,横浜方面,湾岸環八出口,アクセス方法","高","横浜方面からのアクセス方法の明確化","child"
94,"東京方面から平和島出口を利用する場合の道順を教えてください","以下の道順で駐車場にアクセスできます：\n\n【道順】\n1. 首都高速1号羽田線「平和島出口」を出て昭和島方面へ進行。\n2. 南海橋を渡り、1つ目の信号を左折。\n3. 京和橋を渡り、国道357号線を羽田空港方面に右折。\n4. 10mほど進んだ右側が駐車場入口です。\n\n【ナビ設定】\n- カーナビでは「パーク＆ライド羽田」を検索してください。\n- 京浜島ふ頭公園付近が表示されます。\n- 公園向かい側、首都高湾岸線高架下が駐車場です。\n- 電話番号では検索できません。\n\n【Google Mapsでの検索】\n1. 「パーク＆ライド羽田」を検索。\n2. オプションから「高速道路を使わない」を選択してください。","20","navigation_and_access,ナビゲーション,東京方面,平和島出口,アクセス方法","中","東京方面からの代替アクセス方法の明確化","child"
95,"横浜方面から羽田出口を利用する場合の道順を教えてください","以下の道順で駐車場にアクセスできます：\n\n【道順】\n1. 首都高速1号羽田線「羽田出口」を出て環状8号線を羽田方面に右折。\n2. 天空橋駅を越えて2つ目の信号を左折。トンネルを出て環七・大井埠頭方面（357号）へ。\n3. 空港北トンネルを出て1つ目の信号を右折。\n4. 次の信号も右折。\n5. 10mほど進んだ右側が駐車場入口です。\n\n【ナビ設定】\n- カーナビでは「パーク＆ライド羽田」を検索してください。\n- 京浜島ふ頭公園付近が表示されます。\n- 公園向かい側、首都高湾岸線高架下が駐車場です。\n- 電話番号では検索できません。\n\n【Google Mapsでの検索】\n1. 「パーク＆ライド羽田」を検索。\n2. オプションから「高速道路を使わない」を選択してください。","20","navigation_and_access,ナビゲーション,横浜方面,羽田出口,アクセス方法","中","横浜方面からの代替アクセス方法の明確化","child"